{
  "schema_version": "m1-manifest/v1",
  "status": "MEASURED_REFERENCE_CONFORMANCE",
  "normative_contracts": [
    "spec/m1-kernel-contract.v1.json",
    "spec/schema/m1-kernel.v1.schema.json",
    "spec/m1-manifest.v1.json"
  ],
  "inherited_normative_dependencies": [
    {
      "artifact": "spec/schema/protocol.v1.schema.json",
      "sha256": "sha256:a81a44d3d572cc43bc459adc62374ee261549758e0687263a887a3774a863da2"
    },
    {
      "artifact": "spec/canonicalization.v1.json",
      "sha256": "sha256:87b14b371d8572125164326b74d0574a11b00e4f11ba0c117dfe84644d1a7ccc"
    }
  ],
  "self_validating_schemas": [
    "spec/schema/m1-kernel.v1.schema.json",
    "spec/schema/m1-kernel-contract.v1.schema.json",
    "spec/schema/m1-fixtures.v1.schema.json",
    "spec/schema/m1-manifest.v1.schema.json"
  ],
  "schema_bindings": [
    {
      "artifact": "spec/m1-kernel-contract.v1.json",
      "schema": "spec/schema/m1-kernel-contract.v1.schema.json"
    },
    {
      "artifact": "spec/m1-manifest.v1.json",
      "schema": "spec/schema/m1-manifest.v1.schema.json"
    },
    {
      "artifact": "fixtures/m1/cases.json",
      "schema": "spec/schema/m1-fixtures.v1.schema.json"
    }
  ],
  "conformance_fixture": "fixtures/m1/cases.json",
  "golden_outputs": [
    "fixtures/m1/golden/observe-with-effect.transition.json",
    "fixtures/m1/golden/invalid-calendar-timestamp.rejection.json"
  ],
  "reference_implementation": [
    "src/flrh_kernel/__init__.py",
    "src/flrh_kernel/canonical.py",
    "src/flrh_kernel/kernel.py"
  ],
  "non_normative_tools": [
    "scripts/m1_fixtures.py",
    "scripts/m1_guard.py",
    "scripts/check_m1_ambient.py",
    "scripts/run_m1_replay.py",
    "scripts/validate_m1.py",
    "tests/test_m1_kernel.py"
  ],
  "mechanics_tests": [
    "F1 byte-stable canonical transition replay in two spawned clean processes",
    "F2 fresh-process audit and explicit-surface ambient denial plus inert EffectProposal output",
    "F3 closed typed rejection with recursively write-detecting caller inputs"
  ],
  "completion_boundary": "M1 is limited to the declared Python pure-F reference slice and corpus. M2 logic, M3 reactive flow, M4 durable Harness, M5 graphs, M6 interoperability, M7 efficacy, and Lakatos progress remain unjudged."
}
